<?xml version="1.0" encoding="UTF-8"?>
<!ELEMENT goods (good*)>
<!ELEMENT good (goodName,goodPrice,goodType,goodDesception,goodRepertory,merchantID,goodBrand,goodSellCount,url)>
<!ATTLIST good ID CDATA #REQUIRED>
<!ELEMENT goodName (#PCDATA)>
<!ELEMENT goodPrice (#PCDATA)>
<!ELEMENT goodType (#PCDATA)>
<!ELEMENT goodDesception (#PCDATA)>
<!ELEMENT goodRepertory (#PCDATA)>
<!ELEMENT goodBrand (#PCDATA)>
<!ELEMENT goodSellCount (#PCDATA)>
<!ELEMENT url (#PCDATA)>